{
  "artifact_reference": "ppcx-year-sim:cycle-046",
  "claim_id": "eds-year-cycle-046",
  "digest": "sha256:a2dd381491b7968e07842978d3434264f568dfbf24540e494fb18b8a8531701d",
  "environment": {
    "cycle_no": "46",
    "historical": "False"
  },
  "execution_command": "ppcx.sim.fond_engine.run_cycle",
  "id": "eds-year-cycle-046-receipt",
  "inputs": "{\"master_seed\": 20260912, \"random_values\": {\"execute-artifact\": 0.6346465609941995, \"falsify-check\": 0.3238353497378218, \"manufacture-artifact\": 0.4003461846439115, \"verify-result\": 0.35680165795506646}}",
  "outputs": "VERIFIED",
  "source_revision": "ppcx-year-sim@1",
  "supports_proposition": "weekly EDS research cycle 46 (2027-06-12) produces a genuine, evidenced increment along the paper's Sec.4 loop",
  "timestamp": "2027-06-12",
  "validators": [
    "OutcomeContradictionFalsifier",
    "DictSubsetVerifier"
  ]
}
