{
  "artifact_reference": "ppcx-year-sim:cycle-005",
  "claim_id": "eds-year-cycle-005",
  "digest": "sha256:c12ed0a0b9ffeb93066e7c2c5e9cb87be7bc2cf5efc164c160a345f9a94965e7",
  "environment": {
    "cycle_no": "5",
    "historical": "True"
  },
  "execution_command": "historical (forced)",
  "id": "eds-year-cycle-005-receipt",
  "inputs": "{\"master_seed\": 20260912, \"random_values\": {}}",
  "outputs": "VERIFIED",
  "source_revision": "ppcx-year-sim@1",
  "supports_proposition": "weekly EDS research cycle 5 (2026-08-29) produces a genuine, evidenced increment along the paper's Sec.4 loop",
  "timestamp": "2026-08-29",
  "validators": [
    "OutcomeContradictionFalsifier",
    "DictSubsetVerifier"
  ]
}
